{
  "meta": {
    "generated_at": "2026-03-03T21:49:15.752737Z",
    "model_version": "0.2.0",
    "data_version": "0.1.0",
    "baseline_year": 2024,
    "notes": "placeholder demo data; replace with real IPS outputs"
  },
  "scenario": "optimistic",
  "kind": "sensitivity",
  "results": {
    "horizon_years": 10,
    "baseline_kpis": {
      "gdp": 814447313389,
      "rev": 149858305664
    },
    "ranked_parameters": [
      {
        "key": "g_trade",
        "unit": "fraction_per_year",
        "base": 0.01,
        "min": 0.0,
        "max": 0.03,
        "gdp_delta_min": -120000000000,
        "gdp_delta_max": 180000000000,
        "rev_delta_min": -15000000000,
        "rev_delta_max": 22000000000,
        "impact": 180000000000
      },
      {
        "key": "g_governance",
        "unit": "fraction_per_year",
        "base": 0.01,
        "min": 0.0,
        "max": 0.03,
        "gdp_delta_min": -110000000000,
        "gdp_delta_max": 160000000000,
        "rev_delta_min": -14000000000,
        "rev_delta_max": 20000000000,
        "impact": 160000000000
      },
      {
        "key": "g_capital",
        "unit": "fraction_per_year",
        "base": 0.008,
        "min": 0.0,
        "max": 0.025,
        "gdp_delta_min": -70000000000,
        "gdp_delta_max": 120000000000,
        "rev_delta_min": -9000000000,
        "rev_delta_max": 15000000000,
        "impact": 120000000000
      },
      {
        "key": "g_competition",
        "unit": "fraction_per_year",
        "base": 0.007,
        "min": 0.0,
        "max": 0.02,
        "gdp_delta_min": -50000000000,
        "gdp_delta_max": 90000000000,
        "rev_delta_min": -7000000000,
        "rev_delta_max": 11000000000,
        "impact": 90000000000
      },
      {
        "key": "g_talent",
        "unit": "fraction_per_year",
        "base": 0.006,
        "min": 0.0,
        "max": 0.02,
        "gdp_delta_min": -45000000000,
        "gdp_delta_max": 80000000000,
        "rev_delta_min": -6000000000,
        "rev_delta_max": 10000000000,
        "impact": 80000000000
      },
      {
        "key": "tax_to_gdp",
        "unit": "fraction_of_gdp",
        "base": 0.12,
        "min": 0.08,
        "max": 0.2,
        "gdp_delta_min": 0,
        "gdp_delta_max": 0,
        "rev_delta_min": -18000000000,
        "rev_delta_max": 40000000000,
        "impact": 40000000000
      },
      {
        "key": "leakage_rate",
        "unit": "fraction_of_revenue",
        "base": 0.2,
        "min": 0.05,
        "max": 0.4,
        "gdp_delta_min": 0,
        "gdp_delta_max": 0,
        "rev_delta_min": 25000000000,
        "rev_delta_max": -35000000000,
        "impact": 35000000000
      }
    ]
  }
}