{
  "meta": {
    "generated_at": "2026-03-03T21:49:15.752737Z",
    "model_version": "0.2.0",
    "data_version": "0.1.0",
    "baseline_year": 2024,
    "notes": "placeholder demo data; replace with real IPS outputs"
  },
  "scenario": "base",
  "kind": "montecarlo",
  "results": {
    "years": [
      2024,
      2025,
      2026,
      2027,
      2028,
      2029,
      2030,
      2031,
      2032,
      2033,
      2034,
      2035,
      2036,
      2037,
      2038,
      2039
    ],
    "gdp_usd": {
      "p10": [
        340000000000,
        357000000000,
        374850000000,
        393592500000,
        413272125000,
        433935731250,
        455632517812,
        478414143703,
        502334850888,
        527451593433,
        553824173104,
        581515381760,
        610591150848,
        641120708390,
        673176743809,
        706835581000
      ],
      "p50": [
        400000000000,
        420000000000,
        441000000000,
        463050000000,
        486202500000,
        510512625000,
        536038256250,
        562840169062,
        590982177516,
        620531286391,
        651557850711,
        684135743247,
        718342530409,
        754259656929,
        791972639776,
        831571271765
      ],
      "p90": [
        472000000000,
        495600000000,
        520380000000,
        546399000000,
        573718950000,
        602404897500,
        632525142375,
        664151399494,
        697358969468,
        732226917942,
        768838263839,
        807280177031,
        847644185882,
        890026395177,
        934527714935,
        981254100682
      ]
    },
    "gdp_per_capita_usd": {
      "p10": [
        4000,
        4200,
        4410,
        4630,
        4862,
        5105,
        5360,
        5628,
        5910,
        6205,
        6516,
        6841,
        7183,
        7543,
        7920,
        8316
      ],
      "p50": [
        4706,
        4941,
        5188,
        5448,
        5720,
        6006,
        6306,
        6622,
        6953,
        7300,
        7665,
        8049,
        8451,
        8874,
        9317,
        9783
      ],
      "p90": [
        5553,
        5831,
        6122,
        6428,
        6750,
        7087,
        7441,
        7814,
        8204,
        8614,
        9045,
        9497,
        9972,
        10471,
        10994,
        11544
      ]
    },
    "government_revenue_usd": {
      "p10": [
        64000000000,
        67200000000,
        70560000000,
        74088000000,
        77792400000,
        81682020000,
        85766121000,
        90054427050,
        94557148402,
        99285005823,
        104249256114,
        109461718919,
        114934804865,
        120681545109,
        126715622364,
        133051403482
      ],
      "p50": [
        80000000000,
        84000000000,
        88200000000,
        92610000000,
        97240500000,
        102102525000,
        107207651250,
        112568033812,
        118196435503,
        124106257278,
        130311570142,
        136827148649,
        143668506082,
        150851931386,
        158394527955,
        166314254353
      ],
      "p90": [
        100000000000,
        105000000000,
        110250000000,
        115762500000,
        121550625000,
        127628156250,
        134009564062,
        140710042266,
        147745544379,
        155132821598,
        162889462678,
        171033935812,
        179585632602,
        188564914232,
        197993159944,
        207892817941
      ]
    }
  }
}